{
  "schema_version": 1,
  "entity_id": "company.600519",
  "entity_type": "COMPANY",
  "name": "贵州茅台酒股份有限公司",
  "normalized_name": "贵州茅台",
  "aliases": ["茅台", "贵州茅台酒股份"],
  "attributes": {"exchange": "SSE", "code": "600519"},
  "created_at": "2026-08-05T09:00:00+08:00",
  "updated_at": "2026-08-05T09:00:00+08:00"
}
